{
  "format_version": 1,
  "id": "20261028T221039Z-71413fd7ffdb",
  "product_id": "us-citi-strata-premier",
  "recorded_at": "2026-10-28T22:10:39Z",
  "reason": "Initial Phase 2 issuer-source research; unknown effective starts and incomplete coverage remain explicit.",
  "content_sha256": "71413fd7ffdb7318ded2968e0c24d80aefb7e763ef72f04a4bc78702c7fd561e",
  "product": {
    "id": "us-citi-strata-premier",
    "issuer": "Citi",
    "name": "Citi Strata Premier",
    "country": "US",
    "currency": "USD",
    "network": null,
    "audience": "personal",
    "availability": "open",
    "rewards": {
      "program": "citi-thankyou",
      "unit": "points"
    },
    "aliases": [],
    "sources": [
      {
        "id": "us-citi-strata-premier-page",
        "url": "https://www.citi.com/credit-cards/citi-strata-premier-credit-card",
        "title": "Citi Strata Premier official product information",
        "accessed": "2026-10-28"
      }
    ],
    "notes": "General US product terms; excludes welcome offers, insurance and account-specific offers. Null optional fees or network are unconfirmed.",
    "coverage": {
      "fees": "partial",
      "earn_rates": "reviewed",
      "credits": "reviewed",
      "notes": "Reviewed listed ongoing benefits; merchant exclusions in notes remain part of eligibility. Empty credits means none captured, not a guarantee of absence."
    },
    "fees": [
      {
        "effective_from": null,
        "effective_from_basis": "unknown",
        "effective_to": null,
        "status": "verified",
        "source": "us-citi-strata-premier-page",
        "last_verified": "2026-10-28",
        "notes": "Standard annual fee; other fee fields are unconfirmed unless populated.",
        "annual_fee": "95.00",
        "first_year_annual_fee": null,
        "authorized_user_fee": "0.00",
        "foreign_transaction_fee_percent": "0"
      }
    ],
    "earn_rates": [
      {
        "id": "portal-hotels",
        "category": "hotels",
        "versions": [
          {
            "effective_from": null,
            "effective_from_basis": "unknown",
            "effective_to": null,
            "status": "verified",
            "source": "us-citi-strata-premier-page",
            "last_verified": "2026-10-28",
            "notes": "Eligible issuer-portal bookings.",
            "rate": "10",
            "conditions": {
              "channels": ["issuer_portal"]
            },
            "cap": null
          }
        ]
      },
      {
        "id": "portal-car-rental",
        "category": "car_rental",
        "versions": [
          {
            "effective_from": null,
            "effective_from_basis": "unknown",
            "effective_to": null,
            "status": "verified",
            "source": "us-citi-strata-premier-page",
            "last_verified": "2026-10-28",
            "notes": "Eligible issuer-portal bookings.",
            "rate": "10",
            "conditions": {
              "channels": ["issuer_portal"]
            },
            "cap": null
          }
        ]
      },
      {
        "id": "portal-attractions",
        "category": "entertainment",
        "versions": [
          {
            "effective_from": null,
            "effective_from_basis": "unknown",
            "effective_to": null,
            "status": "verified",
            "source": "us-citi-strata-premier-page",
            "last_verified": "2026-10-28",
            "notes": "Attractions through Citi Travel.",
            "rate": "10",
            "conditions": {
              "channels": ["issuer_portal"]
            },
            "cap": null
          }
        ]
      },
      {
        "id": "flights",
        "category": "flights",
        "versions": [
          {
            "effective_from": null,
            "effective_from_basis": "unknown",
            "effective_to": null,
            "status": "verified",
            "source": "us-citi-strata-premier-page",
            "last_verified": "2026-10-28",
            "notes": "Eligible purchases; issuer exclusions apply.",
            "rate": "3",
            "conditions": {
              "channels": ["any"]
            },
            "cap": null
          }
        ]
      },
      {
        "id": "hotels",
        "category": "hotels",
        "versions": [
          {
            "effective_from": null,
            "effective_from_basis": "unknown",
            "effective_to": null,
            "status": "verified",
            "source": "us-citi-strata-premier-page",
            "last_verified": "2026-10-28",
            "notes": "Eligible purchases; issuer exclusions apply.",
            "rate": "3",
            "conditions": {
              "channels": ["any"]
            },
            "cap": null
          }
        ]
      },
      {
        "id": "dining",
        "category": "dining",
        "versions": [
          {
            "effective_from": null,
            "effective_from_basis": "unknown",
            "effective_to": null,
            "status": "verified",
            "source": "us-citi-strata-premier-page",
            "last_verified": "2026-10-28",
            "notes": "Eligible purchases; issuer exclusions apply.",
            "rate": "3",
            "conditions": {
              "channels": ["any"]
            },
            "cap": null
          }
        ]
      },
      {
        "id": "groceries",
        "category": "groceries",
        "versions": [
          {
            "effective_from": null,
            "effective_from_basis": "unknown",
            "effective_to": null,
            "status": "verified",
            "source": "us-citi-strata-premier-page",
            "last_verified": "2026-10-28",
            "notes": "Eligible purchases; issuer exclusions apply.",
            "rate": "3",
            "conditions": {
              "channels": ["any"]
            },
            "cap": null
          }
        ]
      },
      {
        "id": "gas",
        "category": "gas",
        "versions": [
          {
            "effective_from": null,
            "effective_from_basis": "unknown",
            "effective_to": null,
            "status": "verified",
            "source": "us-citi-strata-premier-page",
            "last_verified": "2026-10-28",
            "notes": "Eligible purchases; issuer exclusions apply.",
            "rate": "3",
            "conditions": {
              "channels": ["any"]
            },
            "cap": null
          }
        ]
      },
      {
        "id": "ev-charging",
        "category": "ev_charging",
        "versions": [
          {
            "effective_from": null,
            "effective_from_basis": "unknown",
            "effective_to": null,
            "status": "verified",
            "source": "us-citi-strata-premier-page",
            "last_verified": "2026-10-28",
            "notes": "Eligible purchases; issuer exclusions apply.",
            "rate": "3",
            "conditions": {
              "channels": ["any"]
            },
            "cap": null
          }
        ]
      },
      {
        "id": "base",
        "category": "everything_else",
        "versions": [
          {
            "effective_from": null,
            "effective_from_basis": "unknown",
            "effective_to": null,
            "status": "verified",
            "source": "us-citi-strata-premier-page",
            "last_verified": "2026-10-28",
            "notes": "Other eligible purchases.",
            "rate": "1",
            "conditions": {
              "channels": ["any"]
            },
            "cap": null
          }
        ]
      }
    ],
    "credits": [
      {
        "id": "hotel",
        "name": "Citi Travel Hotel Benefit",
        "category": "hotel",
        "delivery": "in_app",
        "enrollment": "none",
        "match": {
          "keywords": ["Citi Travel Hotel Benefit"]
        },
        "versions": [
          {
            "effective_from": null,
            "effective_from_basis": "unknown",
            "effective_to": null,
            "status": "verified",
            "source": "us-citi-strata-premier-page",
            "last_verified": "2026-10-28",
            "notes": "One Citi Travel hotel stay of at least $500 before taxes/fees; discount at booking.",
            "amount": "100.00",
            "period": "annual",
            "reset_basis": "calendar",
            "period_boundaries": "stated",
            "max_posting_lag_days": null,
            "conditions": {
              "minimum_spend": {
                "amount": "500.00",
                "period": "transaction"
              }
            }
          }
        ]
      }
    ]
  }
}
