{
  "format_version": 1,
  "id": "20261028T221039Z-933d237c9df0",
  "product_id": "us-wells-fargo-active-cash",
  "recorded_at": "2026-10-28T22:10:39Z",
  "reason": "Initial Phase 2 issuer-source research; unknown effective starts and incomplete coverage remain explicit.",
  "content_sha256": "933d237c9df050ca78a1dcc0a5d1f06a0aacb3358cd358a466d22ec900235bd9",
  "product": {
    "id": "us-wells-fargo-active-cash",
    "issuer": "Wells Fargo",
    "name": "Wells Fargo Active Cash",
    "country": "US",
    "currency": "USD",
    "network": "visa",
    "audience": "personal",
    "availability": "open",
    "rewards": {
      "program": "wells-fargo-rewards",
      "unit": "cash"
    },
    "aliases": [],
    "sources": [
      {
        "id": "us-wells-fargo-active-cash-page",
        "url": "https://creditcards.wellsfargo.com/active-cash-visa-credit-card/",
        "title": "Wells Fargo Active Cash official product information",
        "accessed": "2026-10-28"
      }
    ],
    "notes": "General US product terms; excludes welcome offers, insurance and account-specific offers. Null optional fees or network are unconfirmed.",
    "coverage": {
      "fees": "partial",
      "earn_rates": "reviewed",
      "credits": "reviewed",
      "notes": "Reviewed listed ongoing benefits; merchant exclusions in notes remain part of eligibility. Empty credits means none captured, not a guarantee of absence."
    },
    "fees": [
      {
        "effective_from": null,
        "effective_from_basis": "unknown",
        "effective_to": null,
        "status": "verified",
        "source": "us-wells-fargo-active-cash-page",
        "last_verified": "2026-10-28",
        "notes": "Standard annual fee; other fee fields are unconfirmed unless populated.",
        "annual_fee": "0.00",
        "first_year_annual_fee": null,
        "authorized_user_fee": null,
        "foreign_transaction_fee_percent": null
      }
    ],
    "earn_rates": [
      {
        "id": "base",
        "category": "everything_else",
        "versions": [
          {
            "effective_from": null,
            "effective_from_basis": "unknown",
            "effective_to": null,
            "status": "verified",
            "source": "us-wells-fargo-active-cash-page",
            "last_verified": "2026-10-28",
            "notes": "Other eligible purchases.",
            "rate": "2",
            "conditions": {
              "channels": ["any"]
            },
            "cap": null
          }
        ]
      }
    ],
    "credits": []
  }
}
